<?xml version="1.0" encoding="UTF-8"?>
<!DOCTYPE books SYSTEM "books.dtd">
<books version="1.0">
  <book hardcover="yes" isbn="B001">
    <title></title>
    <press></press>
    <page></page>
    <price></price>
    <in/>
    <author no="A001" email="heo@test.com">허균</author>
  </book>
  <book isbn="B002">
    <title></title>
    <press></press>
    <page></page>
    <price></price>
    <author no="A002" email="oh@test.com" tel="111-2222">오호라</author>
    <author no="A003" email="pu@test.com">푸하하</author>
  </book>
</books>









